original_sentence,processed_sentence,term
이번엔  재난방송 스튜디오 연결해 산불 현재 상황을 산불 상황도와 CCTV 통해 살펴보겠습니다.,이번  재난방송 스튜디오 연결해 산불 현재 상황 산불 상황도 CCTV 통해 살펴보겠습니다.,스튜디오
지금까지 재난방송 스튜디오에서 전해드렸습니다.,지금 재난방송 스튜디오 전해드렸습니다.,스튜디오
'대대행 체제'로 한계가 뚜렷했던 미국 도널드 트럼프 행정부발 통상 리스크 대응에 적극 나서겠다는 의지를 피력한 셈이다.,'대대행 체제' 한계 뚜렷했던 미국 도널드 트럼프 행정부발 통상 리스크 대응 적극 나서겠다는 의지 피력한 셈이다.,리스크
이번엔  재난방송 스튜디오 연결해 산불 현재 상황을 산불 상황도와 CCTV 통해 살펴보겠습니다.,이번  재난방송 스튜디오 연결해 산불 현재 상황 산불 상황도 CCTV 통해 살펴보겠습니다.,스튜디오
이번 화재로 산불 진압 시스템의 취약점이 드러나자 체계를 조정해야 한다는 의견도 나온다.,이번 화재 산불 진압 시스템 취약점 드러나자 체계 조정해야 한다는 의견 나온다.,시스템
"'통상전쟁'이 가장 시급, 마은혁 문제도 뇌관 가장 시급한 현안은 글로벌 통상전쟁이다.","'통상전쟁' 가장 시급, 마은혁 문제 뇌관 가장 시급한 현안 글로벌 통상전쟁이다.",글로벌
국립산림과학원의 '산불진화관리와 안전' 매뉴얼에도  적극적으로 진화하되 안전을 최우선으로  탈출로를 확보하고  위험지역에는 감시자를 급파한다 등의 규정이 들어 있다.,국립산림학원 '산불진화관리 안전' 매뉴얼  적극적 진화하되 안전 최우선  탈출로 확보하고  위험지역 감시자 급파한다 등 규정 들어 있다.,매뉴얼
"익명 커뮤니티 등에서는 ""공무원은 불사조냐"" ""산불 나면 산림청에, 선거 때는 선관위에 시달린다""","익명 커뮤니티 등 ""공무원 불사조냐"" ""산불 나면 산림청, 선거 때 선관위 시달린다""",커뮤니티
"제가 지금 나와 있는 이곳 현장 지휘본부도 안전을 위해 의성읍으로 위치를 옮겼는데, 어제 오전까지만 해도 공기가 맑았던 이곳에도 이제는 매캐한 탄내가 가득합니다.","제 지금 나와 있는 이곳 현장 지휘본부 안전 위해 성읍 위치 옮겼는데, 어제 오전 해도 공기 맑았던 이곳 이제 매캐한 탄내가 득합니다.",공기
울주군 특별사법경찰관은 를 조사한 뒤 검찰에 송치할 계획이다.,울주군 특별사법경찰관은  조사한 뒤 검찰 송치할 계획이다.,검찰
의성군은 산불 진화 후 이 성묘객을 검찰에 송치할 예정이다.,의성군 산불 진화 후 이 성묘객 검찰 송치할 예정이다.,검찰
2023년 3월 경남 합천군 용주면에서 산불을 내 나무 22만그루를 태운 50대는 검찰에 송치됐으나 심신미약 등을 이유로 불기소 처분을 받았다.,2023년 3월 경남 합천군 용주면 산불 내 나무 22만그루 태운 50대 검찰 송치됐으나 심신미약 등 이유 불기소 처분 받았다.,검찰
한편 25~26일에는 지난 주말 고비사막과 내몽골고원에서 발원한 황사에 미세 먼지까지 서풍에 실려 우리나라로 유입되며 공기 질이 최악이 될 전망이다.,한편 25~26일 지난 주말 고비사막 내몽골고원 발원한 황사 미세 먼지 서풍 실려 우리나라 유입되며 공기 질이 최악 될 전망다.,공기
이번엔  재난방송 스튜디오 연결해 산불 현재 상황을 산불 상황도와 CCTV 통해 살펴보겠습니다.,이번  재난방송 스튜디오 연결해 산불 현재 상황 산불 상황도 CCTV 통해 살펴보겠습니다.,스튜디오
"""화마가 의성에서 가장 동쪽 마을인 옥산면 민가 바로 앞까지 들이닥쳤습니다. 의용소방대원들은 방화선을 구축하고, 불길을 막기 위해 사투를 벌이고 있습니다.""","""화마 의성 가장 동쪽 마을인 옥산면 민가 바로 앞 들이닥쳤습니다. 의용소방대원들 방화선 구축하고, 불길 막기 위해 사투 벌이고 있습니다.""",방화선
이번엔  재난방송 스튜디오 연결해 산불 현재 상황을 산불 상황도와 CCTV 통해 살펴보겠습니다.,이번  재난방송 스튜디오 연결해 산불 현재 상황 산불 상황도 CCTV 통해 살펴보겠습니다.,스튜디오
"당국은 다음날 일출 전까지 국가주요시설과 민가 등 주변에 인력 배치하고 방화선을 구축, 오는 25일 해가 뜨는 대로 진화 헬기 등을 재투입해 대대적인 진화 작업에 나설 계획이다.","당국 다음날 일출 전 국가주요시설 민가 등 주변 인력 배치하고 방화선 구축, 오는 25일 해 뜨는 대로 진화 헬기 등 재투입해 대대적인 진화 작업 나설 계획이다.",방화선
다음날 일출 전까지 국가 주요시설과 민가 등에 인력을 배치하고 방화선을 구축한다는 계획이다.,다음날 일출 전 국가 주요시설 민가 등 인력 배치하고 방화선 구축한다는 계획이다.,방화선
또 다음날 일출 전까지 국가주요시설과 민가 등 주변에 인력 배치하고 방화선을 구축할 방침입니다.,또 다음날 일출 전 국가주요시설 민가 등 주변 인력 배치하고 방화선 구축할 방침입니다.,방화선
사흘째 계속된 의성 산불이 이날 오후 4시 10분쯤 도로를 경계로 두고 마주한 안동시 길안면 현하리 야산으로까지 번진 상황이라 방화선 구축 범위는 전날보다 늘었습니다.,사흘째 계속된 의성 산불이 날 오후 4시 10분쯤 도로 경계 두고 마주한 안동시 길안면 현하리 야산 번진 상황이라 방화선 구축 범위 전날 늘었습니다.,방화선
오히려 연기나 먼지가 공기 중에 갇혀서 헬기를 운항할 때 시야가 방해될 수 있다는 우려도 나옵니다?,오히려 연기 먼지 공기 중 갇혀서 헬기 운항할 때 시야 방해될 수 있다는 우려 나옵니다?,공기
어떤 시스템이 바뀌어야 한다고 보시나요?,어떤 시스템 바뀌어야 한다고 보시나요?,시스템
"특히 변전소, 요양시설, 문화 유산시설 등에 지상진화대원과 공중진화대를 우선 투입해 방화선 구축하는 등 작업도 벌였다.","특히 변전소, 요양시설, 문화 유산시설 등 지상진화대원 공중진화대 우선 투입해 방화선 구축하는 등 작업 벌였다.",방화선
"김 지사는 또 ""산불 발생 시에는 헬기를 집중적으로 투입해 초기 진압에 최선을 다하고, 발생지 인근 시군에서도 경계를 가리지 말고 가용 자원과 인력을 지원해 확산 차단에 총력을 다하라""라고 강조했다.","김 지사 또 ""산불 발생 시 헬기 집중적 투입해 초기 진압 최선 다하고, 발생지 인근 시군 경계 가리지 말고 가용 자원 인력 지원해 확산 차단 총력 다하라"" 강조했다.",가용 자원
"유승민 회장 ""희생자에 깊은 애도"" 체육시설 점검과 사전 예방 조치 요청 대한체육회가 최근 전국적으로 발생한 대형 산불과 관련해 각 시도 및 시군구체육회에 위기대응 매뉴얼을 전달했다.","유승민 회장 ""희생자 깊은 애"" 체육시설 점검 사전 예방 조치 요청 대한체육회 최근 전국적 발생한 대형 산불 관련해 각 시도 및 시군구체육회 위기대응 매뉴얼 전달했다.",매뉴얼
상대습도가 낮으면 공기 중 수분이 적기 때문에 낙엽과 나뭇가지가 더 빨리 마른다.,상대습도 낮으면 공기 중 수분 적기 때문 낙엽 나뭇가지 더 빨리 마른다.,공기
"권춘근 국립산림과학원 박사는 ""기후변화로 인해 앞으로 국내에서도 산불은 연중화되고 또 대형화될 것""이라며 ""장기적으로 산불에 대한 위험성을 예측해 선제적으로 대비하는 시스템이 필요하다""고 말했다.","권춘근 국립산림학원 박사 ""기후변화 인해 앞 국내 산불 연중화되고 또 대형화될 것""이라며 ""장기적 산불 대한 위험성 예측해 선제적 대비하는 시스템 필요하다"" 말했다.",시스템
"경상남도 산청, 경상북도 의성 등 영남권을 중심으로 전국 곳곳에서 동시다발적으로 발생한 산불로 사상자가 발생하는 등 피해가 막심한 가운데, 대한체육회가 긴급하게 시 도 및 시 군 구체육회에 위기대응 매뉴얼을 전달했다.","경상남도 산청, 경상북도 성 등 영남권 중심 전국 곳곳 동시다발적 발생한 산불 사상자가 발생하는 등 피해 막심한 운데, 대한체육회 긴급하게 시  및 시 군 구체육회 위기대응 매뉴얼 전달했다.",매뉴얼
"최민건 BGF리테일 ESG팀장은 ""앞으로도 행정안전부 등과 24시간 핫라인을 유지하며 상시 모니터링을 통해 추가 지원이 필요할 경우 빠르게 대응하도록 만전을 기하겠다""고 전했다.","최민건 BGF리테일 ESG팀장 ""앞 행정안전부 등 24시간 핫라인 유지하며 상시 모니터링 통해 추가 지원 필요할 경우 빠르게 대응하도록 만전 기하겠다"" 전했다.",모니터링
"최민건 BGF리테일 ESG팀장은 ""앞으로도 행정안전부 등과 24시간 핫라인을 유지하며 상시 모니터링을 통해 추가 지원이 필요할 경우 빠르게 대응하도록 만전을 기하겠다""고 전했다.","최민건 BGF리테일 ESG팀장 ""앞 행정안전부 등 24시간 핫라인 유지하며 상시 모니터링 통해 추가 지원 필요할 경우 빠르게 대응하도록 만전 기하겠다"" 전했다.",핫라인
"이재범 센터장은 ""현재 수도권을 제외한 대부분 지역 대기 상층 공기가 깨끗해 그 영향으로 오전까지 나빴던 대기질이 대부분 좋아졌다""면서도 ""서해안 쪽의 미세먼지가 2차로 유입될 가능성을 검토하고 있다""고 설명했다.","이재범 센터장 ""현재 수도권 제외한 대부분 지역 대기 상층 공기 깨끗해 그 영향 오전 나빴던 대기질 대부분 좋아졌다""면서 ""서해안 쪽 미세먼지 2차 유입될 가능성 검토하고 있다"" 설명했다.",공기
"대통령실은 대변인실 명의 공지를 통해 ""한덕수 권한대행 겸 총리의 직무 복귀가 국정 정상화의 출발점이 되길 기대한다""며 이같이 전했다.","대통령실 대변인실 명의 공지 통해 ""한덕수 권한대행 겸 총리 직무 복귀 국정 정상화 출발점이 되길 기대한다""며 이같 전했다.",공지
공기가 산을 타고 오를 때 차고 건조해졌다가 정상을 넘어 내려갈 때 다시 따뜻해지면서 산 아래 지역에 고온건조한 바람이 부는 '푄현상'이 나타나기 때문이다.,공기 산 타고 오를 때 차고 건조해졌다가 정상 넘어 내려갈 때 다시 따뜻해지면서 산 아래 지역 고온건조한 바람이 부 '푄현상'이 나타나기 때문다.,공기
기온이 높으면 공기가 품을 수 있는 수증기의 한도가 늘어나고 지표면 수분 증발량을 늘리는 요인이 된다.,기온 높으면 공기 품을 수 있는 수증기 한도 늘어나고 지표면 수분 증발량 늘리는 요인 된다.,공기
"한편 GS리테일은 전국에 위치한 편의점 GS25, 홈쇼핑 GS샵, 슈퍼마켓 GS더프레시, 물류센터 등 폭넓은 사업 인프라를 바탕으로 재난 발생 시 신속한 구호 활동을 통해 지역사회 안전망 강화에 앞장서고 있다.","한편 GS리테일 전국 위치한 편의점 GS25, 홈쇼핑 GS샵, 슈퍼마켓 GS더프레시, 물류센터 등 폭넓은 사업 인프라 바탕 재난 발생 시 신속한 구호 활동 통해 지역사회 안전망 강화 앞장서고 있다.",인프라
"특히, 밤부터는 중국발 황사까지 유입되면서 공기가 더 탁해질 것으로 전망됩니다.","특히, 밤 중국발 황사 유입되면서 공기 더 탁해질 것 전망됩니다.",공기
"GS리테일은 전국에 있는 편의점 GS25와 홈쇼핑 GS샵, 슈퍼마켓 GS더프레시, 물류센터 등 사업 인프라를 바탕으로 재난 발생 시 신속한 구호 활동에 앞장서고 있다.","GS리테일 전국 있는 편의점 GS25 홈쇼핑 GS샵, 슈퍼마켓 GS더프레시, 물류센터 등 사업 인프라 바탕 재난 발생 시 신속한 구호 활동 앞장서고 있다.",인프라
한편 최근 발생한 황사가 오늘과 내일 우리나라 상공으로 유입될 것으로 예상돼 공기가 탁해지겠습니다.,한편 최근 발생한 황사 오늘 내일 우리나라 상공 유입될 것 예상돼 공기 탁해지겠습니다.,공기
내일도 공기 질이 계속 좋지 않겠습니다.,내일 공기 질 계속 좋지 않겠습니다.,공기
출근길 큰 추위는 없지만 공기가 몹시 탁합니다.,출근길 큰 추위 없지만 공기 몹시 탁합니다.,공기
"조선일보는 ""당사자인 윤 대통령과 이 대표의 공식적 '승복' 선언도 없다""며 ""이러다 정말 망국적 사태가 빚어지는 것 아닌지 걱정하는 국민이 적지 않다""고 했다.","조선일보 ""당사자인 윤 대통령 이 대표 공식적 '승복' 선언 없다""며 ""이러다 정말 망국적 사태 빚어지는 것 아닌지 걱정하는 국민 적지 않다"" 했다.",적지
"경향신문은 ""소방 산림 당국은 진화 장비와 시설을 확충하고, 방재 위험예보 시스템과 재난 대응 체계를 더욱 촘촘히 구축해야 한다""며 ""진화 매뉴얼도 가다듬어 진화 도중 인명피해가 없도록 해야 하고, 빨리 발견해 조기 진화하는 종합대책을 마련해 매년 되풀이되는 봄철 산불의 악순환을 끊어야 한다""고 했다.","경향신문 ""소방 산림 당국 진화 장비 시설 확충하고, 방재 위험예보 시스템 재난 대응 체계 더욱 촘촘히 구축해야 한다""며 ""진화 매뉴얼도 가다듬어 진화 중 인명피해 없도록 해야 하고, 빨리 발견해 조기 진화하는 종합대책 마련해 매년 되풀이되는 봄철 산불 악순환 끊어야 한다"" 했다.",시스템
"중앙일보는 ""매년 반복되는 봄철 산불에 우리가 제대로 된 예방법과 대책을 마련하고 있는지 다시 한번 점검이 필요하다. 산불의 가장 큰 원인이 입산자의 실화(31%)고, 이번 산불도 묘지 정리나 농막 제작 과정에서 불꽃이 튀어 발생한 실화로 추정된다. 봄철 입산 시 실화에 대한 경각심을 높일 필요가 있다""며 ""지자체가 기간제로 뽑아 운영하는 진화대원이 전문 소방 인력이 아닌 지역의 고령자들로 구성된다는 점도 되돌아봐야 한다. 이들은 살수 기능을 갖춘 개조 트럭이나 등짐펌프, 방화선 구축용 갈고리 등을 사용한다. 대형 산불 대응의 책임을 소형 산불에 맞춰진 대원들에게 지우고 있는 것은 아닌지 따져봐야 한다""고 했다.","중앙일보는 ""매년 반복되 봄철 산불 우리 제대로 된 예방법 대책 마련하고 있는지 다시 한번 점검 필요하다. 산불 가장 큰 원인 입산자 실화(31%), 이번 산불 묘지 정리 농막 제작 과정 불꽃 튀어 발생한 실화 추정된다. 봄철 입산 시 실화 대한 경각심 높일 필요 있다""며 ""지자체 기간제 뽑아 운영하는 진화대원 전문 소방 인력 아닌 지역 고령자들 구성된다는 점 되돌아봐야 한다. 이들 살수 기능 갖춘 개조 트럭 등짐펌프, 방화선 구축용 갈고리 등 사용한다. 대형 산불 대응 책임 소형 산불 맞춰진 대원들 지우고 있는 것 아닌지 따져봐야 한다"" 했다.",방화선
"특히, 밤부터는 중국발 황사까지 유입되면서 공기가 더 탁해질 것으로 전망됩니다.","특히, 밤 중국발 황사 유입되면서 공기 더 탁해질 것 전망됩니다.",공기
공기도 탁하겠습니다.,공기 탁하겠습니다.,공기
"특히, 밤부터는 중국발 황사까지 유입되면서 공기가 더 탁해질 전망입니다.","특히, 밤 중국발 황사 유입되면서 공기 더 탁해질 전망입니다.",공기
공기가 산을 타고 오를 때 차고 건조해졌다가 정상을 넘어 내려갈 때 다시 따뜻해지면서 이전보다 뜨겁고 메말라지는 푄현상이 나타나기 때문입니다.,공기 산 타고 오를 때 차고 건조해졌다가 정상 넘어 내려갈 때 다시 따뜻해지면서 이전 뜨겁고 메말라지는 푄현상 나타나기 때문입니다.,공기
대통령실  대통령 탄핵소추에 따른 직무 정지  국무총리실  국무총리 탄핵소추에 따른 직무 정지  감사원  원장 통상업무  외교부  장관 14 00 외통위 전체회의  1차관 14 00 외통위 전체회의  2차관 미국 출장(유엔 안보리 고위급 공개토의 및 안보리 공식회의 참석)  통일부  장관 통상업무  차관 통상업무  국방부  장관 직무대행 통상업무  국가보훈부  장관 10 10 6 25 참전유공자 명비 제막식  차관 통상업무  국민권익위원회  위원장 통상업무  개인정보보호위원회  위원장 16 00 인공지능 스타트업 간담회(서울 강남구 스타트업얼라이언스)  국회  국회의장 통상업무  국민의힘  비상대책위원장 09 00 비상대책위원회의 (국회 본관 228호) 15 00 경남 산청 산불 진화대 사고 희생자 합동분향소 조문 (창녕 군민체육관   경상남도 창녕군 창녕읍 창녕대로 307) 17 00 경남 산청 산불 대피소 방문 (산청 단성중학교   경상남도 산청군 단성면 강누방목로 2)  원내대표 09 00 비상대책위원회의 (국회 본관 228호) 15 00 경남 산청 산불 진화대 사고 희생자 합동분향소 조문 (창녕 군민체육관   경상남도 창녕군 창녕읍 창녕대로 307) 17 00 경북 의성 산불 대피소 방문 (의성 실내체육관   경상북도 의성군 의성읍 충효로 88)  더불어민주당  당대표 10 30 더불어민주당 천막당사 현판식 및 최고위원회의(광화문 앞 더불어민주당 천막당사)  원내대표 10 30 더불어민주당 천막당사 현판식 및 최고위원회의(광화문 앞 더불어민주당 천막당사) 15 30 내란수괴 윤석열 파면 촉구 더불어민주당 국회의원 도보행진(11차)(국회 본청앞광화문 동십자각) 18 30 야5당 공동 비상시국 대응을 위한 범국민대회(광화문 동십자각) 19 00 내란수괴 윤석열 즉각 파면 긴급행동(광화문 동십자각)  조국혁신당  당대표 권한대행 09 30 최고위원회의(국회 본관 당회의실(224호)) 10 00  토론회(의원회관 제9간담회의실) 13 00 윤석열 파면 촉구 '108배 행동'(광화문 천막 당사) 20 10 CBS 유튜브  출연  원내대표 09 30 최고위원회의(국회 본관 당회의실(224호)) 10 00  토론회(의원회관 제9간담회의실) 19 00 윤석열 즉각 퇴진!,대통령실  대통령 탄핵소추 따른 직무 정지  국무총리실  국무총리 탄핵소추 따른 직무 정지  감사원  원장 통상업무  외교부  장관 14 00 외통위 전체회의  1차관 14 00 외통위 전체회의  2차관 미국 출장(유엔 안보리 고위급 공개토의 및 안보리 공식회의 참석)  통일부  장관 통상업무  차관 통상업무  국방부  장관 직무대행 통상업무  국가보훈부  장관 10 10 6 25 참전유공자 명비 제막식  차관 통상업무  국민권익위원회  위원장 통상업무  개인정보보호위원회  위원장 16 00 인공지능 스타트업 간담회(서울 강남구 스타트업얼라이언스)  국회  국회의장 통상업무  국민힘  비상대책위원장 09 00 비상대책위원회 (국회 본관 228호) 15 00 경남 산청 산불 진화대 사고 희생자 합동분향소 조문 (창녕 군민체육관   경상남도 창녕군 창녕읍 창녕 307) 17 00 경남 산청 산불 대피소 방문 (산청 단성중학교   경상남도 산청군 단성면 강누방목 2)  원내대표 09 00 비상대책위원회 (국회 본관 228호) 15 00 경남 산청 산불 진화대 사고 희생자 합동분향소 조문 (창녕 군민체육관   경상남도 창녕군 창녕읍 창녕 307) 17 00 경북 의성 산불 대피소 방문 (성 실내체육관   경상북도 성군 성읍 충효 88)  더불어민주당  당대표 10 30 더불어민주당 천막당사 현판식 및 최고위원회의(광화문 앞 더불어민주당 천막당사)  원내대표 10 30 더불어민주당 천막당사 현판식 및 최고위원회(광화문 앞 더불어민주당 천막당사) 15 30 내란수괴 윤석열 파면 촉구 더불어민주당 국회원 도보행진(11차)(국회 본청앞광화문 동십자각) 18 30 야5당 공동 비상시국 대응 위한 범국민대회(광화문 동십자각) 19 00 내란수괴 윤석열 즉각 파면 긴급행동(광화문 동십자각)  조국혁신당  당대표 권한대행 09 30 최고위원회의(국회 본관 당회의실(224호)) 10 00  토론회(원회관 제9간담회실) 13 00 윤석열 파면 촉구 '108배 행동'(광화문 천막 당사) 20 10 CBS 유튜브  출연  원내대표 09 30 최고위원회(국회 본관 당회실(224호)) 10 00  토론회(원회관 제9간담회실) 19 00 윤석열 즉각 퇴진!,스타트업
범시민대행진(광화문 동십자각)  개혁신당  원내대표 겸 당대표 권한대행 09 30 최고위원회의   개혁신당 대회의실 (국회 본관 170호) 18 05 가톨릭평화방송 라디오   진보당  상임대표 10 00 진보당 3기 제36차 대표단회의(진보당 중앙당사)  원내대표 10 00 진보당 3기 제36차 대표단회의(진보당 중앙당사) 17 00 광화문 농성(광화문 서십자각 진보당 농성장) 18 00 야5당 공동 비상시국 범국민대회(광화문 동십자각) 20 30 의원총회(광화문 서집자각 진보당 농성장)  기본소득당  당대표 10 00 국부펀드를 통한 산업혁신과 이익공유 방안 세미나 (국회의원회관 제5간담회의실)  사회민주당  당대표 겸 원내대표 10 00 전국금융산업노동조합 한국수출입은행지부 제44년차 정기전국대의원대회(한국수출입은행 본점 6층 강당(영등포구 은행로38)) 18 30 야5당 사전집회(광화문 동십자각) 19 00 비상행동 본집회(광화문 동십자각) Copyright   All rights reserved.,범시민대행진(광화문 동십자각)  개혁신당  원내대표 겸 당대표 권한대행 09 30 최고위원회의   개혁신당 대회의실 (국회 본관 170호) 18 05 가톨릭평화방송 라디오   진보당  상임대표 10 00 진보당 3기 제36차 대표단회(진보당 중앙당사)  원내대표 10 00 진보당 3기 제36차 대표단회(진보당 중앙당사) 17 00 광화문 농성(광화문 십자각 진보당 농성장) 18 00 야5당 공동 비상시국 범국민대회(광화문 동십자각) 20 30 의원총회(광화문 집자각 진보당 농성장)  기본소득당  당대표 10 00 국부펀드 통한 산업혁신 이익공유 방안 세미나 (국회의원회관 제5간담회의실)  사회민주당  당대표 겸 원내대표 10 00 전국금융산업노동조합 한국수출입은행지부 제44년차 정기전국대원대회(한국수출입은행 본점 6층 강당(영등포구 은행38)) 18 30 야5당 사전집회(광화문 동십자각) 19 00 비상행동 본집회(광화문 동십자각) Copyright   All rights reserved.,세미나
이후 봄이 되며 불어오는 따뜻한 서풍은 산맥을 넘는 공기의 양이 더 많아 동해안 지역을 더 건조하게 만든다.,이후 봄 되며 불어오는 따뜻한 서풍 산맥 넘는 공기 양 더 많아 동해안 지역 더 건조하게 든다.,공기
"이후로도 지난겨울부터 올봄까지 눈의 양상은 북쪽의 찬 공기가 따뜻한 서해상을 통과하며 눈구름대를 형성하고, 주로 한반도 서쪽에 많은 눈을 뿌리는 패턴을 이어갔다.","이후 지난겨울 올봄 눈 양상 북쪽 찬 공기 따뜻한 서해상 통과하며 눈구름대 형성하고, 주로 한반도 서쪽 많은 눈 뿌리는 패턴 이어갔다.",공기
산불특수진화대 등 인력 1천8백여 명을 투입해 불길이 민가로 내려오지 못하도록 방화선 구축 등에 힘을 쏟고 있습니다.,산불특수진화대 등 인력 1천8백여 명 투입해 불길 민가 내려오지 못하도록 방화선 구축 등 힘 쏟고 있습니다.,방화선
이번엔  재난방송 스튜디오 연결해 산불 현재 상황과 앞으로 전망까지  자세히 짚어보겠습니다.,이번  재난방송 스튜디오 연결해 산불 현재 상황 앞 전망  자세히 짚어보겠습니다.,스튜디오
현재 당국은 야간 대응 체제로 전환해 불길이 민가로 내려오지 못하도록 방화선 구축에 힘을 쏟고 있다.,현재 당국 야간 대응 체제 전환해 불길 민가 내려오지 못하도록 방화선 구축 힘 쏟고 있다.,방화선
불길이 민가로 내려오지 못하도록 방화선 구축 등에 힘을 쏟을 방침이다.,불길 민가 내려오지 못하도록 방화선 구축 등 힘을 쏟 방침이다.,방화선
