original_sentence,processed_sentence,term
◎ 진행자   이 정도면 검찰의 주장을 완전히 단칼에 끊어버린 건데요.,◎ 진행자   이 정도면 검찰 주장 완전히 단칼 끊어버린 건데요.,검찰
"검찰의 주장 정도가 아니고, ◎ 진행자   1심의 판결도 완전히 100% 뒤집은 거 아닙니까?","검찰 주장 정도 아니고, ◎ 진행자   1심의 판결 완전히 100% 뒤집은 거 아닙니까?",검찰
검찰이.,검찰.,검찰
◎ 진행자   그런데 검찰의 향후 대법원 상고 어떻게 보십니까?,◎ 진행자   그런데 검찰 향후 대법원 상고 어떻게 보십니까?,검찰
"검찰이 뭐라고 그러냐 하면 결국 대장동 사건의 의혹이 확산되는 걸 막기 위해서 김문기 몰랐다고 얘기했다는데 그런 것은 이재명 대표가 한 워딩 말 그 자체로만 이것이 맞냐 틀리냐 진실에 반하냐 진실이냐, 또 백현동 건도 용도변경 국토부의 요구에 의해서 변경한 것이다.","검찰 뭐라고 그러냐 하면 결국 대장동 사건의 혹 확산되는 걸 막기 위해서 김문기 몰랐다고 얘기했다는데 그런 것 이재명 대표 한 워딩 말 그 자체 이것 맞냐 틀리냐 진실 반하냐 진실이냐, 또 백현동 건도 용변경 국토부 요구 의해서 변경한 것이다.",검찰
◎ 진행자   1심 판결은 하자가 있었다는 얘기로 들리기도 하는데요.,◎ 진행자   1심 판결 하자 있었다는 얘기 들리기 하는데요.,하자
◎ 박범계   다른 재판들의 속도전이라는 게 재판부 사이즈가 왜 이번에 공선법을 가지고 징역 1년에 집행유예 2년으로 숨을 끊어놓으려고 했느냐.,◎ 박범계   다른 재판들 속도전이라는 게 재판부 사이즈 왜 이번 공선법 가지고 징역 1년 집행유예 2년 숨 끊어놓으려고 했느냐.,사이즈
그런 측면에서 다른 사건의 진행은 정상적으로 진행이 되겠습니다만 그런 부분들도 전체적으로 검찰 독재 하에서 왜곡된 수사와 기소에 의해서 이루어지는 재판들이기 때문에 크게 걱정하지 않습니다.,그런 측면 다른 사건 진행 정상적 진행 되겠습니다 그런 부분들 전체적 검찰 독재 하 왜곡된 수사 기소 의해서 이루어지는 재판들이기 때문 크게 걱정하지 않습니다.,검찰
오늘 그래도 청량제 같은 판결이 있었으니까 그 점으로 위안을 삼으시고 결과적으로는 3월 4일 선고설 3월 14일 선고설 3월 17일 선고설 다 틀리고 이번 주 금요일도 오늘 공지가 없으니까 그러나 이번 주 금요일 선고를 포기하지 않겠습니다.,오늘 그래도 청량제 같은 판결 있었으니까 그 점 위안 삼으시고 결과적 3월 4일 선고설 3월 14일 선고설 3월 17일 선고설 다 틀리고 이번 주 금요일 오늘 공지 없으니까 그러나 이번 주 금요일 선고 포기하지 않겠습니다.,공지
다만 목요일이나 금요일 공지를 통한 다음 주 선고는 기대를 해야 되겠습니다.,다만 목요일 금요일 공지 통한 다음 주 선고 기대 해야 되겠습니다.,공지
"황사가 유입돼 현재도, 공기 질이 좋지 못합니다.","황사 유입돼 현재, 공기 질 좋지 못합니다.",공기
◀ 앵커   고비고비 사법리스크를 뛰어넘은 이재명 대표는 오늘 무죄 선고로 헌재의 탄핵심판 결과에 따라 열리게 될 조기 대선 가도에서 한층 탄력을 받게 됐습니다.,◀ 앵커   고비고비 사법리스크 뛰어넘은 이재명 대표 오늘 무죄 선고 헌재 탄핵심판 결과 따라 열리게 될 조기 대선 가도 한층 탄력 받게 됐습니다.,가도
"지난 2022년 검찰은 대장동 비리 의혹으로 측근들을 줄줄이 구속한 뒤, 이듬해 이 대표에 대해서도 구속영장을 청구했습니다.","지난 2022년 검찰 대장동 비리 의혹 측근들 줄줄이 구속한 뒤, 이듬해 이 대표 대해서 구속영장 청구했습니다.",검찰
"비명계 주자들은 ""사필귀정이다, 이번 기회에 선거법과 사법제도를 바로잡아야 한다""""검찰의 과도한 기소를 바로 잡아 다행이다""""당원으로서 한시름 덜었다. 이제 힘을 모아야 할 때""라며 환영했습니다.","비명계 주자들 ""사필귀정이다, 이번 기회 선거법 사법제도 바로잡아야 한다""""검찰 과도한 기소 바로 잡아 다행이다""""당원 한시름 덜었다. 이제 힘 모아야 할 때""라며 환영했습니다.",검찰
재발 방지를 위해선 산불 대응 시스템의 혁신적인 개선이 요구된다.,재발 방지 위해선 산불 대응 시스템 혁신적인 개선 요구된다.,시스템
"우선 복지부는 산불 위험 우려 지역에 있는 노인요양원, 요양병원 등 재난 대피 취약 시설에 대한 24시간 상황 모니터링을 강화하고, 필요시 입소자에 대한 선제적 대피 조치를 취하는 등 인명피해 예방 조치를 할 계획입니다.","우선 복지부 산불 위험 우려 지역 있는 노인요양원, 요양병원 등 재난 대피 취약 시설 대한 24시간 상황 모니터링 강화하고, 필요시 입소자 대한 선제적 대피 조치 취하는 등 인명피해 예방 조치 할 계획입니다.",모니터링
"우선 복지부는 산불 위험 우려 지역에 있는 노인요양원, 요양병원 등 재난 대피 취약시설에 대한 24시간 상황 모니터링을 강화하고, 필요시 입소자에 대한 선제적 대피 조치를 취하는 등 인명피해 예방조치를 실시할 방침이다.","우선 복지부 산불 위험 우려 지역 있는 노인요양원, 요양병원 등 재난 대피 취약시설 대한 24시간 상황 모니터링 강화하고, 필요시 입소자 대한 선제적 대피 조치 취하는 등 인명피해 예방조치 실시할 방침이다.",모니터링
하지만 불법 소각과 담배꽁초 투기 등으로 인해 여전히 화재 위험이 높은 상황이다.,하지만 불법 소각 담배꽁초 투기 등 인해 여전히 화재 위험이 높은 상황다.,투기
산림청은 내일도 가용 자원을 총동원해 주불 진화에 주력하겠다고 밝혔습니다.,산림청 내일 가용 자원 총동원해 주불 진화 주력하겠다고 밝혔습니다.,가용 자원
"'당연한 결과'인데, 이를 위해 얼마나 많은 에너지와 국가 인력을 소진했느냐며 검찰과 여권을 향해 날을 세웠습니다.","'당연한 결과'인데, 이 위해 얼마나 많은 에너지 국가 인력 소진했느냐며 검찰 여권 향해 날 세웠습니다.",검찰
"특히, ""증거와 사건을 조작""하며 '이재명 잡기'에 혈안이 됐던 검찰은 더 이상 힘을 낭비하지 말라고 쏘아붙였는데요.","특히, ""증거 사건 조작""하며 '이재명 잡기' 혈안 됐던 검찰 더 이상 힘 낭비하지 말라고 쏘아붙였는데요.",검찰
"당국은 정확한 사고 원인을 밝히기 위해 블랙박스 분석과 함께 기체 결함, 기상 조건 등 다양한 가능성을 조사할 방침입니다.","당국 정확한 사고 원인 밝히기 위해 블랙박스 분석 함께 기체 결함, 기상 조건 등 다양한 가능성 조사할 방침입니다.",블랙박스
또한 방화선을 구축해 진화에 총력전을 기울이기로 했다.,또한 방화선 구축해 진화 총력전 기울이기 했다.,방화선
"산림청 헬기 정비 수리 문제로   50대 중 35대만 진화작업 투입   지자체 중소형 헬기론 역부족   토사 유출 등 2차 피해 가능성   산사태위험지역 응급복구 절실 경북 북부와 경남, 울산 등을 휩쓸고 있는 대형산불(국제신문 26일 자 1면 등 보도)로 수많은 사상자가 발생한 가운데 강풍과 장비 부족으로 인한 초기 진화 실패 등의 사유로 산불이 대형화한 것으로 분석된다.","산림청 헬기 정비 수리 문제   50대 중 35대만 진화작업 투입   지자체 중소형 헬기론 역부족   토사 유출 등 2차 피해 가능성   산사태위험지역 응급복구 절실 경북 북부 경남, 울산 등 휩쓸고 있는 대형산불(국제신문 26일 자 1면 등 보도) 수많은 사상자가 발생한 운데 강풍 장비 부족 인한 초기 진화 실패 등 사유 산불 대형화한 것 분석된다.",수리
15대가 정비 또는 수리 문제로 운행하지 못하기 때문이다.,15대 정비 또는 수리 문제 운행하지 못하기 때문이다.,수리
"김동연 경기도지사는 ""검찰의 과도한 기소를 이제라도 바로잡아 다행""이라고 했고, 김경수 전 경남도지사는 ""재판부의 용기에 경의를 표한다""고 밝혔습니다.","김동연 경기도지사 ""검찰 과도한 기소 이제라도 바로잡아 다행"" 했고, 김경수 전 경남도지사 ""재판부 용기 경의 표한다"" 밝혔습니다.",검찰
국가유산의 피해도 적지 않습니다.,국가유산 피해 적지 않습니다.,적지
"우선 복지부는 산불 위험 우려 지역에 있는 노인요양원, 요양병원 등 재난 대피 취약시설에 대한 24시간 상황 모니터링을 강화하고, 필요시 입소자에 대한 선제적 대피 조치를 취하는 등 인명피해 예방조치를 실시할 계획이다.","우선 복지부 산불 위험 우려 지역 있는 노인요양원, 요양병원 등 재난 대피 취약시설 대한 24시간 상황 모니터링 강화하고, 필요시 입소자 대한 선제적 대피 조치 취하는 등 인명피해 예방조치 실시할 계획이다.",모니터링
1층 구석에서 바쁘게 돌아가는 공기청정기에는 오후 내내 빨간불(위험 공기가 매우 나쁘다는 뜻)이 들어왔다.,1층 구석 바쁘게 돌아가는 공기청정기 오후 내내 빨간불(위험 공기 매우 나쁘다는 뜻) 들어왔다.,공기
26일 유튜브 채널 '무대뽀조성근'을 운영하는 는 전날 안동 산불 현장에서 인터넷 방송 플랫폼 SOOP(숲 구 아프리카TV)을 통해 라이브 방송을 진행했다.,26일 유튜브 채널 '무대뽀조성근' 운영하는  전날 안동 산불 현장 인터넷 방송 플랫폼 SOOP(숲 구 아프리카TV) 통해 라이브 방송 진행했다.,플랫폼
해당 영상은 여러 온라인 커뮤니티에도 널리 공유됐다.,해당 영상 여러 온라인 커뮤니티 널리 공유됐다.,커뮤니티
위험천만한 만큼 헬기 성능과 안전 매뉴얼을 더 챙겨야 한다.,위험천만한 만큼 헬기 성능 안전 매뉴얼 더 챙겨야 한다.,매뉴얼
"그런데 소화헬기는 내구연한이 법적으로 정해져 있지 않고, 노후 헬기라도 정비 상태만 양호하면 운항이 가능하게 돼 있다.","그런데 소화헬기 내구연한 법적 정해져 있지 않고, 노후 헬기라도 정비 상태 양호하면 운항 가능하게 돼 있다.",내구연한
오후 8시쯤 산불이 병원 쪽으로 번지려 하자 보건의료원 측은 119구급대 등 가용 구급차를 동원해 120㎞ 떨어진 시립문경요양병원으로 환자들을 옮겼다.,오후 8시쯤 산불 병원 쪽 번지려 하자 보건의료원 측 119구급대 등 가용 구급차 동원해 120㎞ 떨어진 시립문경요양병원 환자들 옮겼다.,하자
검찰을 비판하면서 나온 발언인데 수권 정당의 면모를 강조하기 위한 것으로 풀이됩니다.,검찰 비판하면서 나온 발언인데 수권 정당 면모 강조하기 위한 것 풀이됩니다.,검찰
지난 25일 밤 한 온라인 커뮤니티에는 교정직 공무원으로 추정되는  글이 올라왔다.,지난 25일 밤 한 온라인 커뮤니티 교정직 공무원 추정되는  글 올라왔다.,커뮤니티
"이 영상은 다른 온라인 커뮤니티로 확산했고, 교정직 공무원의 처우에 대한 응원의 메시지가 이어졌다.","이 영상 다른 온라인 커뮤니티 확산했고, 교정직 공무원 처우 대한 응원 메시지 이어졌다.",커뮤니티
항소심에서 뒤집히면서 이 대표는 사법 리스크를 덜게 되었습니다.,항소심 뒤집히면서 이 대표 사법 리스크 덜게 되었습니다.,리스크
"이 대표는 ""진실과 정의에 기반해 제대로 된 판결해 준 재판부에 감사하다""면서 ""검찰과 정권이 이재명을 잡기 위해서 증거와 사건을 조작하느라 썼던 그 역량을 우리 산불 예방이나 국민들의 삶을 개선하는데 썼다면 얼마나 좋은 세상이 됐겠냐""라고 지적했는데요.","이 대표 ""진실 정의 기반해 제대로 된 판결해 준 재판부 감사하다""면서 ""검찰 정권이 재명 잡기 위해서 증거 사건 조작하느라 썼던 그 역량 우리 산불 예방 국민들 삶 개선하는데 썼다면 얼마나 좋은 세상 됐겠냐"" 지적했는데요.",검찰
"민주당 김민석 수석 최고위원은 에 ""2심 판사가 너무 성실하고 꼼꼼하게 모든 쟁점을 다 짚어서 검찰이 부끄러웠을 거 같다는 생각이 든다""라면서 ""(검찰이 상고하더라도) 이 문제에 대한 판단은 끝났다고 본다. 헌재가 빨리 파면하는 게 최대 과제다""라고 답을 했습니다.","민주당 김민석 수석 최고위원  ""2심 판사 너무 성실하고 꼼꼼하게 모든 쟁점 다 짚어서 검찰 부끄러웠을 거 같다는 생각 든다""라면서 ""(검찰 상고하더라도)  문제 대한 판단 끝났다고 본다. 헌재 빨리 파면하는 게 최대 과제다"" 답 했습니다.",검찰
김만권   이재명 대표가 걸려있는 모든 사법 리스크 중에 어쩌면 가장 쉽게 지나갈 이슈라고 생각했던 거였는데 가장 무거운 형이 떨어졌죠.,김만권   이재명 대표 걸려있는 모든 사법 리스크 중 어쩌면 가장 쉽게 지나갈 이슈라고 생각했던 거였는데 가장 무거운 형 떨어졌죠.,리스크
"결국 이 두 건 모두 무죄(공직선거법 2심 무죄, 위증교사혐의 1심 무죄)가 나온 상황이기 대문에 이 대표가 사법 리스크를 상당히 덜어낸 모양새입니다.","결국  두 건 모두 무죄(공직선거법 2심 무죄, 위증교사혐의 1심 무죄) 나온 상황이기 대문 이 대표 사법 리스크 상당히 덜어낸 모양새입니다.",리스크
윤 대통령 지지자들이 정 재판관의 집 주소를 찾아내 온라인 커뮤니티에 공개하고 집 주변에 찾아가 고성을 지르며 위협했습니다.,윤 대통령 지지자들 정 재판관 집 주소 찾아내 온라인 커뮤니티 공개하고 집 주변 찾아가 고성 지르며 위협했습니다.,커뮤니티
하지만 우리가 사법 시스템을 믿는 이유는 철저하게 예측 가능성에서 움직이기 때문입니다.,하지만 우리 사법 시스템 믿는 이유 철저하게 예측 가능성 움직이기 때문입니다.,시스템
늘 재난에 대처하는 매뉴얼이 있지만 재난이 매뉴얼대로 일어나지 않는다는 게 가장 큰 문제죠.,늘 재난 대처하는 매뉴얼 있지만 재난 매뉴얼 일어나지 않는다는 게 가장 큰 문제죠.,매뉴얼
이번에는 재난방송 스튜디오를 연결해 산불 확산 상황을 지도를 통해 살펴보겠습니다.,이번 재난방송 스튜디오 연결해 산불 확산 상황 지도 통해 살펴보겠습니다.,스튜디오
지금까지 재난방송 스튜디오에서 전해드렸습니다.,지금 재난방송 스튜디오 전해드렸습니다.,스튜디오
방금 전과 비슷한 시각인 오후 5시쯤  안동에서 찍힌 영상인데 고층에서 찍은 걸로 보이는데도 굉장히 공기가 희뿌옇죠.,방금 전 비슷한 시각인 오후 5시쯤  안동 찍힌 영상인데 고층 찍은 걸로 보이는데 굉장히 공기 희뿌옇죠.,공기
강한 바람과 메마른 공기 등 악조건을 감안하더라도 신속한 사전 대피 안내가 사실상 제대로 이뤄지지 않은 데다 그나마 발송된 재난문자조차 혼란만 부추기면서 대규모 인명 피해를 부른 참극으로 직결됐다는 거센 비판이 쏟아지고 있다.,강한 바람 메마른 공기 등 악조건 감안하더라도 신속한 사전 대피 안내 사실상 제대로 이뤄지지 않은 데 그나마 발송된 재난문자 혼란 부추기면서 대규모 인명 피해 부른 참극 직결됐다는 거센 비판 쏟아지고 있다.,공기
이날 NC 다이노스와의 홈 경기 개시에 앞서 삼성 구단은 전광판을 통해 애도의 뜻을 표하기도 했다.,이날 NC 다이노스 홈 경기 개시 앞서 삼성 구단 전광판 통해 애도 뜻 표하기 했다.,개시
"이어 ""검찰과 정권이 이재명을 잡기 위해 증거를 조작하고 사건을 조작하느라 쓴 그 역량을 산불 예방이나 국민의 삶 개선을 위해 썼다면 얼마나 좋은 세상이 됐겠느냐""라며 ""이제 검찰도 자신들의 행위를 되돌아보고 더는 이런 국력 낭비를 하지 않길 바란다""고 강조했다.","이어 ""검찰 정권이 재명 잡기 위해 증거 조작하고 사건 조작하느라 쓴 그 역량 산불 예방 국민 삶 개선 위해 썼다면 얼마나 좋은 세상이 됐겠느냐""라며 ""제 검찰 자신들 행위 되돌아보고 더 이런 국력 낭비 하지 않길 바란다"" 강조했다.",검찰
"전현희 최고위원은 페이스북에 ""오늘은 위대한 국민 승리의 날이자 정치검찰 사망선고의 날이다. 법원이 이 대표에게 무죄를 선고하고 불의한 검찰에겐 유죄를 선고했다""며 ""정의가 승리한 사필귀정 판결""이라고 강조했다.","전현희 최고위원 페이스북 ""오늘 위대한 국민 승리 날이자 정치검찰 사망선고 날이다. 법원이  대표 무죄 선고하고 불한 검찰 유죄 선고했다""며 ""정의 승리한 사필귀정 판결"" 강조했다.",검찰
"김병주 최고위원도 ""정의와 진실의 승리이자 민주주의의 승리다. 검찰의 부당한 기소와 정치적 음모에 대한 명백한 반박""이라며 ""공정하고 현명한 판단을 해준 재판부에 깊은 감사의 말씀을 드린다. 민주당은 앞으로도 국민과 함께 정의롭고 공정한 사회를 만들어 나가는 데 최선을 다하겠다""고 적었다.","김병주 최고위원 ""정의 진실의 승리이자 민주주 승리다. 검찰 부당한 기소 정치적 음모 대한 명백한 반박""이라며 ""공정하고 현명한 판단 해준 재판부 깊은 감사 말씀 드린다. 민주당 앞 국민 함께 정의롭고 공정한 사회 만들어 나가는 데 최선 다하겠다"" 적었다.",검찰
"김선민 혁신당 대표 권한대행은 페이스북에 ""검찰 독재정권의 폭압 속에도 민주주의와 정의가 살아있음을 확인했다""며 ""이 대표 무죄 판결은 검찰 권력을 향한 파면 선고다. 법원은 오늘 검찰의 수사와 기소가 정치 보복, 사법살인 시도였다고 판단한 것""이라고 해석했다.","김선민 혁신당 대표 권한대행 페이스북 ""검찰 독재정권 폭압 속 민주주의 정의 살아있음 확인했다""며 ""이 대표 무죄 판결 검찰 권력 향한 파면 선고다. 법원 오늘 검찰 수사 기소 정치 보복, 사법살인 시도였다고 판단한 것"" 해석했다.",검찰
해당 발언은 온라인 커뮤니티를 통해 확산하기 시작했다.,해당 발언 온라인 커뮤니티 통해 확산하기 시작했다.,커뮤니티
온라인 커뮤니티 에펨코리아에서는 관련 영상이 포함된 게시글이 하루 만에 조회 수 85만 회를 기록했다.,온라인 커뮤니티 펨코리아 관련 영상 포함된 게시글 하루 만 조회 수 85만 회 기록했다.,커뮤니티
"조 장관은 이날 긴급 상황점검회의에서 ""기존 재난안전 초기대응반을 확대하여 소관 시설 관련 부서를 포함하는 비상대책반을 꾸리고, 소관 시설 24시간 상황 모니터링, 의료 생계 심리지원 등 빠른 일상 회복을 위해 총력 지원할 계획""이라고 밝혔다.","조 장관 이날 긴급 상황점검회의 ""기존 재난안전 초기대응반 확대하여 소관 시설 관련 부서 포함하는 비상대책반 꾸리고, 소관 시설 24시간 상황 모니터링, 의료 생계 심리지원 등 빠른 일상 회복 위해 총력 지원할 계획"" 밝혔다.",모니터링
"이를 통해 24시간 재난 취약시설 모니터링, 피해 상황 복구, 이재민 긴급 지원 등 총력 지원한다는 계획이다.","이 통해 24시간 재난 취약시설 모니터링, 피해 상황 복구, 이재민 긴급 지원 등 총력 지원한다는 계획이다.",모니터링
조기 대선이 열릴 경우 '후보 자격 박탈' 리스크를 털어낸 상태에서 대권 도전에 나설 수 있게 됐다.,조기 대선 열릴 경우 '후보 자격 박탈' 리스크 털어낸 상태 대권 도전 나설 수 있게 됐다.,리스크
"그는 ""검찰과 이 정권이 이재명을 잡기 위해 증거를 조작하고, 사건을 조작하느라 썼던 그 역량을 우리 산불 예방이나 아니면 국민 삶을 개선하는 데 썼더라면 얼마나 좋은 세상이 됐겠느냐""고 했다.","그 ""검찰 이 정권이 재명 잡기 위해 증거 조작하고, 사건 조작하느라 썼던 그 역량 우리 산불 예방 아니면 국민 삶 개선하는 데 썼더라면 얼마나 좋은 세상 됐겠느냐"" 했다.",검찰
반대로 헌재가 윤 대통령 탄핵을 각하 기각한다면 조기 대선은 없던 일이 되고 이 대표의 사법 리스크 역시 다시 살아나게 된다.,반 헌재 윤 대통령 탄핵 각하 기각한다면 조기 대선 없던 일이 되고  대표 사법 리스크 역시 다시 살아나게 된다.,리스크
검찰은 법원 선고 2시간30여분 만에 상고 뜻을 밝혔다.,검찰 법원 선고 2시간30여분 만 상고 뜻 밝혔다.,검찰
"실제 지난 25일 편성 내역을 보면 KBS1은 오후 6시50분 뉴스특보와 9시 특집뉴스 사이에 일일연속극 '결혼하자 맹꽁아!'를, KBS2는 같은 시각 일일드라마 '신데렐라 게임' '셀럽병사의 비밀 스페셜'을 방송했다.","실제 지난 25일 편성 내역 보면 KBS1 오후 6시50분 뉴스특보 9시 특집뉴스 사이 일일연속극 '결혼하자 맹꽁아!', KBS2 같은 시각 일일드라마 '신데렐라 게임' '셀럽병사 비밀 스페셜' 방송했다.",내역
"또다른 온라인 커뮤니티 이용자는 ""KBS가 지금 재난방송 24시간 내내 틀어줘서 다들 대피하게 도와야지, KBS가 아니면 대체 이걸 누가 할 수 있나""라며 ""특히 공중파는 항상 틀어놓고 많이 보시는 청송 일대 어르신들이 심각성을 더 빨리 인지하고 조치할 수 있었을 텐데, 언론이야말로 자기 직무를 제대로 못해 더 큰 인명피해를 야기한 것 아니냐""라고 했다.","또다른 온라인 커뮤니티 이용자 ""KBS 지금 재난방송 24시간 내내 틀어줘서 다들 대피하게 와야지, KBS가 아니면 대체 이걸 누 할 수 있나""라며 ""특히 공중파는 항상 틀어놓고 많이 보시 청송 일대 어르신들 심각성을 더 빨리 인지하고 조치할 수 있었 텐데, 언론 자기 직무 제대로 못해 더 큰 인명피해 야기한 것 아니냐"" 했다.",커뮤니티
25일 밤 한 온라인 커뮤니티에는 자신을 골프장 캐디라고 소개한  글이 올라왔다.,25일 밤 한 온라인 커뮤니티 자신 골프장 캐디라고 소개한  글 올라왔다.,커뮤니티
"복지부는 기존 재난안전 초기대응반 운영을 확대해 소관 시설 관련 부서를 포함하는 비상대책반을 꾸려 24시간 재난 취약시설 모니터링, 피해 상황 복구, 이재민 긴급지원 등을 통해 빠른 일상 회복을 지원한다.","복지부 기존 재난안전 초기대응반 운영 확대해 소관 시설 관련 부서 포함하는 비상대책반 꾸려 24시간 재난 취약시설 모니터링, 피해 상황 복구, 이재민 긴급지원 등 통해 빠른 일상 회복 지원한다.",모니터링
"또한 산불 대응체계를 통해 태풍이나 폭우 등 자연재해에 준하는 수준으로 정비하고, 선로변 CCTV 등을 활용해 모니터링을 강화하고 열차 운행안전을 확보할 계획이다.","또한 산불 대응체계 통해 태풍 폭우 등 자연재해 준하는 수준 정비하고, 선로변 CCTV 등 활용해 모니터링 강화하고 열차 운행안전 확보할 계획이다.",모니터링
"24시간 재난 취약시설 모니터링, 피해 상황 복구, 이재민 긴급지원 등을 통해 빠른 일상 회복에 총력 지원한다.","24시간 재난 취약시설 모니터링, 피해 상황 복구, 이재민 긴급지원 등 통해 빠른 일상 회복 총력 지원한다.",모니터링
"화재 희생자 대부분 70 80대 거동 힘들어 제때 대피 못해 행정당국 미숙한 대처 논란 산촌 대피 매뉴얼조차 없어 지난 22일부터 닷새간 이어지고 있는 경북 산불이 25일부터 안동, 청송, 영양, 영덕 등 경북 북동부 지역으로 급속히 확산되면서 인명 피해가 크게 늘어났다.","화재 희생자 대부분 70 80대 거동 힘들어 제때 대피 못해 행정당국 미숙한 대처 논란 산촌 대피 매뉴얼 없어 지난 22일 닷새간 이어지고 있는 경북 산불 25일 안동, 청송, 영양, 영덕 등 경북 북동부 지역 급속히 확산되면서 인명 피해 크게 늘어났다.",매뉴얼
