original_sentence,processed_sentence,term
"공기청정기나 에어컨 사용 시에는 '외부 공기 유입 차단' 모드나 '순환 모드'로 설정할 것. 2. 실내 청소 요령  물걸레를 이용해 먼지를 닦아내고, 진공청소기는 HEPA 필터가 장착된 제품만 사용한다.","공기청정기 에어컨 사용 시 '외부 공기 유입 차단' 모드 '순환 모드' 설정할 것. 2. 실내 청소 요령  물걸레 이용해 먼지 닦아내고, 진공청소기 HEPA 필터 장착된 제품 사용한다.",공기
"일반 진공청소기는 오히려 먼지를 다시 공기 중에 날릴 수 있다. 3. '청정 공간' 만들기  집안에서 창문이 없는 방을 선택해 청정 공간으로 설정하고, HEPA 필터 공기청정기를 사용한다.","일반 진공청소기 오히려 먼지 다시 공기 중 날릴 수 있다. 3. '청정 공간' 만들기  집안 창문 없는 방 선택해 청정 공간 설정하고, HEPA 필터 공기청정기 사용한다.",공기
화재 피해 차량 입고 시 수리 비용을 최대 50% 할인해 고객 부담을 덜어줄 계획이다.,화재 피해 차량 입고 시 수리 비용 최대 50% 할인해 고객 부담 덜어줄 계획이다.,수리
피해 차량 수리 완료 후에는 무상 세차 서비스도 함께 제공할 계획이다.,피해 차량 수리 완료 후 무상 세차 서비스 함께 제공할 계획이다.,수리
화재 피해 차량 입고 시 수리 비용을 최대 50% 할인해주고 피해 차량 수리 완료 후에는 무상 세차 서비스도 함께 제공할 계획이다.,화재 피해 차량 입고 시 수리 비용 최대 50% 할인해주고 피해 차량 수리 완료 후 무상 세차 서비스 함께 제공할 계획이다.,수리
먼저  재난방송 스튜디오 연결해 산불 확산 상황을 지도를 통해 살펴보겠습니다.,먼저  재난방송 스튜디오 연결해 산불 확산 상황 지도 통해 살펴보겠습니다.,스튜디오
지금까지 재난방송 스튜디오에서 전해드렸습니다.,지금 재난방송 스튜디오 전해드렸습니다.,스튜디오
"과기정통부 관계자는 ""산불 확산 및 방송통신 장애 발생에 따라 24시간 모니터링 및 총력 대응 체계를 유지하고 있으며, 재난 상황에서 국민의 방송통신서비스 이용을 보장하기 위해 대응 및 복구에 만전을 기하겠다""고 말했다.","과기정통부 관계자 ""산불 확산 및 방송통신 장애 발생 따라 24시간 모니터링 및 총력 대응 체계 유지하고 있으며, 재난 상황 국민 방송통신서비스 이용 보장하기 위해 대응 및 복구 전 기하겠다"" 말했다.",모니터링
"정부는 이러한 심각한 상황을 극복하고, 가용 자원을 최대한 효율적으로 투입하기 위해 산불 위기 단계를 전국 '심각' 단계로 격상하고, '국가 소방 동원령' 경찰의 '갑호 비상'을 발령하는 등 전 국가적인 대응을 하고 있습니다.","정부 이러한 심각한 상황 극복하고, 가용 자원 최대한 효율적 투입하기 위해 산불 위기 단계 전국 '심각' 단계 격상하고, '국가 소방 동원령' 경찰 '갑호 비상' 발령하는 등 전 국가적인 대응 하고 있습니다.",가용 자원
"한 권한대행은 ""정부는 이러한 심각한 상황을 극복하고 가용자원을 최대한 효율적으로 투입하기 위해 산불 위기단계를 전국 '심각' 단계로 격상하고 국가소방동원령, 경찰의 갑호비상을 발령하는 등 전 국가적인 대응을 하고 있다""며 ""밤사이 주거지역, 다중이용시설 등 인명피해 우려시설에 대한 산불확산 지연제도 적극 살포했다""고 말했다.","한 권한대행 ""정부 이러한 심각한 상황 극복하고 가용자원 최대한 효율적 투입하기 위해 산불 위기단계 전국 '심각' 단계 격상하고 국가소방동원령, 경찰 갑호비상 발령하는 등 전 국가적인 대응 하고 있다""며 ""밤사이 주거지역, 다중이용시설 등 인명피해 우려시설 대한 산불확산 지연제 적극 살포했다"" 말했다.",가용자원
"화재 피해 차량 입고 시 수리 비용을 최대 50% 할인해줌으로써 고객 부담을 덜어줄 계획이며, 피해 차량 수리 완료 후에는 무상 세차 서비스도 함께 제공할 계획이다.","화재 피해 차량 입고 시 수리 비용 최대 50% 할인해줌 고객 부담 덜어줄 계획이며, 피해 차량 수리 완료 후 무상 세차 서비스 함께 제공할 계획이다.",수리
"그러면서 ""어제 오후부터 긴급히 주민대피가 이뤄졌으나 안타까운 인명피해를 막지 못했고 곳곳에서 전기와 통신이 끊기고, 도로가 차단되는 등 혼란스러운 상황이 밤새 지속됐다""며 "" 정부는 이런 심각한 상황을 극복하고, 가용자원을 최대한 효율적으로 투입하기 위해 산불 위기단계를 전국 '심각' 단계로 격상하고, '국가소방동원령' 경찰의 '갑호비상'을 발령하는 등 전 국가적인 대응을 하고 있다""고 설명했다.","그러면서 ""어제 오후 긴급히 주민대피 이뤄졌으나 안타까운 인명피해 막지 못했고 곳곳 전기 통신 끊기고, 도로 차단되는 등 혼란스러운 상황 밤새 지속됐다""며 "" 정부 이런 심각한 상황 극복하고, 가용자원 최대한 효율적 투입하기 위해 산불 위기단계 전국 '심각' 단계 격상하고, '국가소방동원령' 경찰 '갑호비상' 발령하는 등 전 국가적인 대응 하고 있다"" 설명했다.",가용자원
연예계 대표 기부천사인 가수 겸 배우 수지도 산불 피해 지원을 위해 성금 1억원을 기부했다.,연예계 대표 기부천사인 가수 겸 배우 수지 산불 피해 지원 위해 성금 1억원 기부했다.,수지
"화재 피해 차량 입고 시 수리 비용을 최대 50% 할인하고, 피해 차량 수리 완료 후에는 무상 세차 서비스도 함께 제공한다.","화재 피해 차량 입고 시 수리 비용 최대 50% 할인하고, 피해 차량 수리 완료 후 무상 세차 서비스 함께 제공한다.",수리
수리 비용 지원은 자차보험 미가입 고객이 대상이다.,수리 비용 지원 자차보험 미가입 고객이 대상다.,수리
민주당이 재난 예비비를 삭감한 근거 중의 하나는 국회 입법조사처가 발간한 '2023 국정감사 이슈 분석 보고서'에서도 지적한 내용 때문입니다.,민주당 재난 예비비 삭감한 근거 중 하나 국회 입법조사처 발간한 '2023 국정감사 이슈 분석 보고서' 지적한 내용 때문입니다.,이슈
"과기정통부 관계자는 ""산불 확산 및 방송통신 장애 발생에 따라 24시간 모니터링 및 총력 대응 체계를 유지하고 있으며, 재난 상황에서 국민의 방송통신서비스 이용을 보장하기 위해 대응 및 복구에 만전을 기하겠다""고 전했다.","과기정통부 관계자 ""산불 확산 및 방송통신 장애 발생 따라 24시간 모니터링 및 총력 대응 체계 유지하고 있으며, 재난 상황 국민 방송통신서비스 이용 보장하기 위해 대응 및 복구 전 기하겠다"" 전했다.",모니터링
"화재 피해 차량 입고 시 수리 비용을 최대 50% 할인하고, 피해 차량 수리 완료 후에는 무상 세차 서비스도 함께 제공할 계획이다.","화재 피해 차량 입고 시 수리 비용 최대 50% 할인하고, 피해 차량 수리 완료 후 무상 세차 서비스 함께 제공할 계획이다.",수리
27일 밤부터 북서쪽에서 찬 공기가 유입돼 기온이 뚝 떨어질 전망입니다.,27일 밤 북서쪽 찬 공기 유입돼 기온 뚝 떨어질 전망입니다.,공기
특히 찬 공기는 밀도가 높아 가라앉는 성질이 있어 지상에 강풍을 부릅니다.,특히 찬 공기 밀도가 높아 라앉는 성질 있어 지상 강풍 부릅니다.,공기
"화재 피해 차량 입고 시 수리 비용을 최대 50% 할인해줌으로써 고객 부담을 덜어줄 계획이며, 피해 차량 수리 완료 후에는 무상 세차 서비스도 함께 제공할 계획이다.","화재 피해 차량 입고 시 수리 비용 최대 50% 할인해줌 고객 부담 덜어줄 계획이며, 피해 차량 수리 완료 후 무상 세차 서비스 함께 제공할 계획이다.",수리
"경상남도와 산림청을 중심으로 소방청, 경찰청, 군부대, 기상청 등 유관기관이 긴밀한 협조체계를 유지하고 가용자원을 총동원하여 도민의 안전을 지키기 위하여 끝까지 최선을 다하겠습니다.","경상남도 산림청 중심 소방청, 경찰청, 군부대, 기상청 등 유관기관 긴밀한 협조체계 유지하고 가용자원 총동원하여 도민 안전 지키기 위하여 끝 최선 다하겠습니다.",가용자원
평년보다 따뜻한 날씨는 26일 밤 북서쪽에서 찬 공기가 남하하면서 다소 누그러지겠다.,평년 따뜻한 날씨 26일 밤 북서쪽 찬 공기 남하하면서 다소 누그러지겠다.,공기
포근하던 날씨는 27일 밤부터 북서쪽에서 찬 공기가 유입되면서 기온이 뚝 떨어질 전망이다.,포근하던 날씨 27일 밤 북서쪽 찬 공기 유입되면서 기온이 뚝 떨어질 전망다.,공기
게다가 찬 공기는 밀도가 높아 가라앉아 지상에 강풍을 일으킨다.,게다가 찬 공기 밀도가 높아 라앉아 지상 강풍 일으킨다.,공기
기상청은 내일 밤 북서쪽에서 찬 공기가 유입되며 기온이 점점 낮아질 것으로 전망했습니다.,기상청 내일 밤 북서쪽 찬 공기 유입되며 기온 점점 낮아질 것 전망했습니다.,공기
특히 이번 대규모 산불 재난에서는 2020년 첫 도입된 재난로밍 시스템이 처음으로 활용됐다.,특히 이번 대규모 산불 재난 2020년 첫 도입된 재난로밍 시스템 처음 활용됐다.,시스템
"정부는 재난로밍 외에도 전쟁, 대규모 자연재해 등에 대비한 재난 통신망 대응 매뉴얼을 갖추고 주기적으로 상황 대응 훈련을 진행하고 있다.","정부 재난로밍 외 전쟁, 대규모 자연재해 등 대비한 재난 통신망 대응 매뉴얼 갖추고 주기적 상황 대응 훈련 진행하고 있다.",매뉴얼
"무선망 상호백업체계는 타 통신사 유선망을 경유해 국내 인터넷, 모바일 메신저, 금융, 생활편의 서비스 등을 정상적으로 이용할 수 있도록 하는 방식이다.","무선망 상호백업체계 타 통신사 유선망 경유해 국내 인터넷, 모바일 메신저, 금융, 생활편의 서비스 등 정상적 이용할 수 있도록 하는 방식이다.",메신저
통신 인프라 자체가 재난으로 파괴된 경우에는 통신사들이 이동발전기와 이동기지국을 실은 차량을 투입해 복구 작업을 실시하고 완전히 마비되는 것을 방지한다.,통신 인프라 자체 재난 파괴된 경우 통신사들이 동발전기 이동기지국 실은 차량 투입해 복구 작업 실시하고 완전히 마비되는 것 방지한다.,인프라
"과기정통부 관계자는 ""산불 확산 및 방송통신 장애 발생에 따라 24시간 모니터링 및 총력 대응 체계를 유지하고 있다""며 ""재난 상황에서 국민의 방송통신서비스 이용을 보장하기 위해 대응 및 복구에 만전을 기하겠다""고 전했다.","과기정통부 관계자 ""산불 확산 및 방송통신 장애 발생 따라 24시간 모니터링 및 총력 대응 체계 유지하고 있다""며 ""재난 상황 국민 방송통신서비스 이용 보장하기 위해 대응 및 복구 전 기하겠다"" 전했다.",모니터링
"과기정통부 관계자는 ""산불 확산 및 방송 통신 장애 발생에 따라 24시간 모니터링 및 총력 대응 체계를 유지하고 있으며 재난 상황에서 국민의 방송 통신서비스 이용을 보장하기 위해 대응과 복구에 전력을 기울이겠다""고 밝혔다.","과기정통부 관계자 ""산불 확산 및 방송 통신 장애 발생 따라 24시간 모니터링 및 총력 대응 체계 유지하고 있으며 재난 상황 국민 방송 통신서비스 이용 보장하기 위해 대응 복구 전력 기울이겠다"" 밝혔다.",모니터링
자차보험 미가입 고객을 대상으로 화재 피해 차량 입고 시 수리 비용을 최대 50% 할인한다.,자차보험 미가입 고객 대상 화재 피해 차량 입고 시 수리 비용 최대 50% 할인한다.,수리
수리 완료 후에는 무상 세차 서비스도 함께 제공할 계획이다.,수리 완료 후 무상 세차 서비스 함께 제공할 계획이다.,수리
화재 피해 차량 입고 시 수리 비용을 최대 50% 할인해줌으로써 고객 부담을 덜어줄 계획이다.,화재 피해 차량 입고 시 수리 비용 최대 50% 할인해줌 고객 부담 덜어줄 계획이다.,수리
피해 차량 수리 완료 후에는 무상 세차 서비스도 함께 제공할 계획이다.,피해 차량 수리 완료 후 무상 세차 서비스 함께 제공할 계획이다.,수리
27일 밤부터 북서쪽에서 찬 공기가 유입돼 기온이 뚝 떨어질 전망이다.,27일 밤 북서쪽 찬 공기 유입돼 기온이 뚝 떨어질 전망다.,공기
특히 찬 공기는 밀도가 높아 가라앉는 성질이 있어 지상에 강풍을 부른다.,특히 찬 공기 밀도가 높아 라앉는 성질 있어 지상 강풍 부른다.,공기
"화재 피해 차량 입고 시 수리 비용을 최대 50% 할인하고, 피해 차량 수리 완료 후에는 무상 세차 서비스도 함께 제공할 계획이다.","화재 피해 차량 입고 시 수리 비용 최대 50% 할인하고, 피해 차량 수리 완료 후 무상 세차 서비스 함께 제공할 계획이다.",수리
"과기정통부 관계자는 ""산불 확산 및 방송 통신 장애 발생에 따라 24시간 모니터링 및 총력 대응 체계를 유지하고 있으며 재난 상황에서 국민의 방송 통신서비스 이용을 보장하기 위해 대응과 복구에 전력을 기울이겠다""고 밝혔습니다.","과기정통부 관계자 ""산불 확산 및 방송 통신 장애 발생 따라 24시간 모니터링 및 총력 대응 체계 유지하고 있으며 재난 상황 국민 방송 통신서비스 이용 보장하기 위해 대응 복구 전력 기울이겠다"" 밝혔습니다.",모니터링
"피해 차 수리 완료 뒤에는 무상 세차 서비스도 함께 제공할 계획이다. (자차보험 미가입 고객 대상, 피해 사실 확인서 필요, 총 할인금액 기준 300만원 한도 내 지원)","피해 차 수리 완료 뒤 무상 세차 서비스도 함께 제공할 계획이다. (자차보험 미가입 고객 대상, 피해 사실 확인서 필요, 총 할인금액 기준 300만원 한 내 지원)",수리
"과기정통부 관계자는 ""산불 확산 및 방송통신 장애 발생에 따라 24시간 모니터링 및 총력 대응 체계를 유지하고 있다""면서 ""재난 상황에서 국민의 방송통신서비스 이용을 보장하기 위해 대응 및 복구에 만전을 기하겠다""고 전했다.","과기정통부 관계자 ""산불 확산 및 방송통신 장애 발생 따라 24시간 모니터링 및 총력 대응 체계 유지하고 있다""면서 ""재난 상황 국민 방송통신서비스 이용 보장하기 위해 대응 및 복구 전 기하겠다"" 전했다.",모니터링
"강도현 2차관 ""가용자원 총동원, 빠른 시일 내 우편 통신망 복구"" 이처럼 방송통신재난 위기경보 '주의' 격상에 따라 강도현 과기정통부 2차관은 26일 통신 장애 발생지역인 안동시를 방문해 5개 유 무선통신사업자(KT, SKT, LGU+SKB, LG헬로비전)와 함께 통신망 피해현황을 살피고, 복구대책을 논의 후 인근 현장을 방문해 복구 상황을 점검했다.","강도현 2차관 ""가용자원 총동원, 빠른 시일 내 우편 통신망 복구"" 이 방송통신재난 위기경보 '주의' 격상 따라 강도현 과기정통부 2차관 26일 통신 장애 발생지역인 안동시 방문해 5개 유 무선통신사업자(KT, SKT, LGU+SKB, LG헬로비전) 함께 통신망 피해현황 살피고, 복구대책 논의 후 인근 현장 방문해 복구 상황 점검했다.",가용자원
"강 차관은 ""우편소통 및 통신망 이용에 불편함이 없도록 정부의 가용 자원을 총 동원하여 빠른 시일 내 우편 업무와 통신망을 복구하겠다""면서 ""이번 산불로 피해를 입은 국민들에게 깊은 위로를 표하며, 위기상황 극복을 위하여 방송통신재난 관리 업무에 부처 역량을 결집하겠다""고 강조했다.","강 차관 ""우편소통 및 통신망 이용 불편함 없도록 정부 가용 자원 총 동원하여 빠른 시일 내 우편 업무 통신망 복구하겠다""면서 ""이번 산불 피해 입은 국민들 깊은 위로 표하며, 위기상황 극복 위하여 방송통신재난 관리 업무 부처 역량 결집하겠다"" 강조했다.",가용 자원
"현재 과기정통부는 산불로 인한 방송통신서비스 장애를 최소화하기 위해, 사업자와 함께 24시간 모니터링 체계를 지속 유지하고 있으며, 필요시 재난로밍, 재난 와이파이 개방 등 모든 수단과 역량을 총동원한다는 계획이다.","현재 과기정통부 산불 인한 방송통신서비스 장애 최소화하기 위해, 사업자 함께 24시간 모니터링 체계 지속 유지하고 있으며, 필요시 재난로밍, 재난 와이파이 개방 등 모든 수단 역량 총동원한다는 계획이다.",모니터링
다만 27일 밤부터 북서쪽에서 찬 공기가 남하하면서 기온이 차차 낮아져 28일은 평년과 비슷하거나 조금 낮을 것으로 예상된다.,다만 27일 밤 북서쪽 찬 공기 남하하면서 기온 차차 낮아져 28일 평년 비슷하거나 조금 낮을 것 예상된다.,공기
"그러면서 ""이번 화재를 계기로 정부가 산불 대응 시스템을 근본적으로 점검하고 중장기적인 대응책을 마련해야 한다""고 강조했다.","그러면서 ""이번 화재 계기 정부 산불 대응 시스템 근본적 점검하고 중장기적인 대응책 마련해야 한다"" 강조했다.",시스템
"그는 ""기후 위기 시대, 봄철 산불은 일시적인 재난이 아니라 구조적인 위험이 됐다""며 ""미국에서는 위성을 통해 산불을 조기에 감지해 대응하는 시스템을 개발 중이라는 말도 들었다. 우리도 이제는 이러한 재난 조기 경보 시스템을 빨리 개발할 필요가 있다""며 강조했다.","그 ""기후 위기 시대, 봄철 산불 일시적인 재난 아니라 구조적인 위험 됐다""며 ""미국 위성 통해 산불 조기 감지해 대응하는 시스템 개발 중이라는 말 들었다. 우리 이제 이러한 재난 조기 경보 시스템 빨리 개발할 필요 있다""며 강조했다.",시스템
"김복희 코리안 독스 대표는 ""재난 시 사람의 안전이 최우선이라는 점에 이의를 제기할 사람은 없다""며 ""하지만 2022년 행정안전부도 '재난 시 반려동물 가족을 위한 재난 대응 가이드라인'을 제정 발표한 만큼 이를 준수하기 위한 노력이 절실하다""고 강조했다.","김복희 코리안 독스 대표 ""재난 시 사람 안전이 최우선라는 점 이의 제기할 사람 없다""며 ""하지만 2022년 행정안전부도 '재난 시 반려동물 가족 위한 재난 대응 가이드라인' 제정 발표한 만큼 이 준수하기 위한 노력 절실하다"" 강조했다.",가이드라인
"화재 피해 차량 입고 시 수리 비용을 최대 50% 할인해줌으로써 고객 부담을 덜어줄 계획이며, 피해 차량 수리 완료 후에는 무상 세차 서비스도 함께 제공할 계획이다.","화재 피해 차량 입고 시 수리 비용 최대 50% 할인해줌 고객 부담 덜어줄 계획이며, 피해 차량 수리 완료 후 무상 세차 서비스 함께 제공할 계획이다.",수리
먼저  재난방송 스튜디오 연결해 산불 확산 상황을 지도를 통해 살펴보겠습니다.,먼저  재난방송 스튜디오 연결해 산불 확산 상황 지도 통해 살펴보겠습니다.,스튜디오
지금까지 재난방송 스튜디오에서 전해드렸습니다.,지금 재난방송 스튜디오 전해드렸습니다.,스튜디오
재테크 노하우 머니쇼 '어제장 오늘장'   장연재 관세 앞에 작아지고 주눅드는 시장입니다.,재테크 노하우 머니쇼 '어제장 오늘장'   장연재 관세 앞 작아지고 주눅드는 시장입니다.,노하우
정치 이슈에 영향을 받는 데다 강달러까지 더해진 결과입니다.,정치 이슈 영향 받는 데 강달러 더해진 결과입니다.,이슈
"오락가락 관세 정책에 주눅드는 시장, 지금 시장 영향력이 큰 관세와 정치적 이슈에서 잠시 벗어나서 배당 이슈도 체크하시죠.","오락가락 관세 정책 주눅드는 시장, 지금 시장 영향력 큰 관세 정치적 이슈 잠시 벗어나서 배당 이슈 체크하시죠.",이슈
"한편 어제 시간 외 거래에서는 산불 관련해서 소방기구, 소방 시스템, 공기청정기 등의 관련주들이 강했습니다.","한편 어제 시간 외 거래 산불 관련해서 소방기구, 소방 시스템, 공기청정기 등 관련주들 강했습니다.",시스템
"과기정통부 관계자는 ""산불 확산 및 방송통신 장애 발생에 따라 24시간 모니터링 및 총력 대응 체계를 유지하고 있으며, 재난 상황에서 국민의 방송통신서비스 이용을 보장하기 위해 대응 및 복구에 만전을 기하겠다""고 밝혔다.","과기정통부 관계자 ""산불 확산 및 방송통신 장애 발생 따라 24시간 모니터링 및 총력 대응 체계 유지하고 있으며, 재난 상황 국민 방송통신서비스 이용 보장하기 위해 대응 및 복구 전 기하겠다"" 밝혔다.",모니터링
"검찰은 이 대표에게 징역 2년을 구형했는데, 만약 1심과 마찬가지로 유죄 판결이 유지될 경우, 이 대표 대권 가도에 '빨간불'이 켜질 수 있다는 분석이 나옵니다.","검찰 이 대표 징역 2년 구형했는데, 만약 1심 마찬가지 유죄 판결이 유지될 경우,  대표 대권 가도 '빨간불' 켜질 수 있다는 분석 나옵니다.",가도
"검찰은 이 대표에게 징역 2년을 구형했는데, 만약 1심과 마찬가지로 유죄 판결이 유지될 경우, 이 대표 대권 가도에 '빨간불'이 켜질 수 있다는 분석이 나옵니다.","검찰 이 대표 징역 2년 구형했는데, 만약 1심 마찬가지 유죄 판결이 유지될 경우,  대표 대권 가도 '빨간불' 켜질 수 있다는 분석 나옵니다.",검찰
"과기정통부 관계자는 ""산불 확산 및 방송통신 장애 발생에 따라 24시간 모니터링 및 총력 대응 체계를 유지하고 있다""며 ""재난 상황에서 국민의 방송통신서비스 이용을 보장하기 위해 대응 및 복구에 만전을 기하겠다""고 말했다.","과기정통부 관계자 ""산불 확산 및 방송통신 장애 발생 따라 24시간 모니터링 및 총력 대응 체계 유지하고 있다""며 ""재난 상황 국민 방송통신서비스 이용 보장하기 위해 대응 및 복구 전 기하겠다"" 말했다.",모니터링
"과기정통부 관계자는 ""산불 확산 및 방송 통신 장애 발생에 따라 24시간 모니터링 및 총력 대응 체계를 유지하고 있으며, 재난 상황에서 국민의 방송 통신서비스 이용을 보장하기 위해 대응과 복구에 전력을 기울이겠다""고 전했습니다.","과기정통부 관계자 ""산불 확산 및 방송 통신 장애 발생 따라 24시간 모니터링 및 총력 대응 체계 유지하고 있으며, 재난 상황 국민 방송 통신서비스 이용 보장하기 위해 대응 복구 전력 기울이겠다"" 전했습니다.",모니터링
"이날 교정직 공무원 는 한 온라인 커뮤니티에 ""교도소 불탄다""는 내용의 글을 올렸다.","이날 교정직 공무원  한 온라인 커뮤니티 ""교도소 불탄다"" 내용 글 올렸다.",커뮤니티
"가 ""119 직원들 며칠 동안 비상 걸려서 정신 놓은 건 이해하겠는데 도망도 못 가는 우리 안쪽이 식구들은 지금 숨구멍을 놓게 생겼는데 제정신인지 묻고 싶다""고 하자, 는 ""3시간 전에 다 이감했다길래 제가 '그거 가짜 아니냐'고 하니까 말 자르고 알아서 하라는 식""이라고 상황을 공유했다."," ""119 직원들 며칠 동안 비상 걸려서 정신 놓은 건 이해하겠는데 도망 못 가는 우리 안쪽 식구들 지금 숨구멍 놓게 생겼는데 제정신인지 묻고 싶다"" 하자,  ""3시간 전 다 이감했다길래 제 '그거 짜 아니냐'고 하니까 말 자르 알아서 하라는 식"" 상황 공유했다.",하자
